id	run	counter	disposition_cleaned	disposition	color	caseid	subject	location	summary	Initial_category	date
3434	First Run	3434	No action	No Action	Purple	201200369	CBP Border Patrol-Other Employee	HIDALGO, TX	MSA reported that his wife with whom he resides has not yet obtained legal residency status Edinburg, TX	Association	10/12/2011
1807	First Run	1807	No action	No action	Orange	200804049	CBP Border Patrol-Agent	CAMERON, TX	Detainee alleges BPA hit her in the mouth with his baton, Harlingen, TX.	Force	2/13/2008
1780	First Run	1780	Counseling	formal counseling	Orange	200803971	CBP Supervisory Officer	WEBB, TX	Allegedly downloaded music files to the LAN, Laredo, TX.	Discipline	2/11/2008
3574	First Run	3574	No action	No Action	Purple	201200834	CBP Border Patrol-Agent	HARRIS, TX	BPA brother arrested by Houston PD for felony (1st degree) Manufacture/Delivery of Controlled Substance	Association	10/21/2011
4347	First Run	4347	Counseling	Counseling	Purple	201203192	CBP Border Patrol-Agent	EL PASO, TX	Alleged disreputable association and drug use prior to employment as a BPA, EL Paso, TX.	Association	12/20/2011
4357	First Run	4357	No action	No Action	Purple	201203216	CBP Border Patrol-Agent	HUDSPETH, TX	BPA is allegedly a subject of interest in an FBI investigation, Sierra Blanca, TX.	Off-duty	12/21/2011
3959	First Run	3959	No action	No Action	Purple	201202108	CBP Border Patrol-Agent	CAMERON, TX	BPA arrested by Port Isabel, TX, PD for DUI on November 20, 2011. Eagle Pass, TX	Off-duty	11/21/2011
6795	First Run	6795	Counseling	written counseling	Pink	201306459	CBP Border Patrol-Agent	WEBB, TX	BPA ran over the power and phone boxes located in the primary lane of Laredo West Checkpoint (B-35).	Vehicle	3/21/2013
9287	Second Run	920	No action	No Action	Purple	201206608	CBP Border Patrol-Agent	VAL VERDE, TX	PIG: BPA alleged knowledge of wife's use of cocaine during BPA hiring process, Del Rio, TX.	Association	3/26/2012
9983	Second Run	1616	No action	No Action	Purple	201208712	CBP Officer	HIDALGO, TX	AMSCO: CBPO home address is associated with narcotics-related TECS records (Mission, TX).	Association	5/16/2012
11223	Second Run	1134	Open	Open disposition pending	Pink	201309638	CBP Officer	CAMERON, TX	CBPO Alleged Gambling On Duty, Brownsville, TX	Discipline	6/25/2013
9699	Second Run	1332	Counseling	Counseling	Purple	201207927	CBP Border Patrol-Agent	IMPERIAL, CA	BPA arrested by El Centro, CA, PD for Public Intoxication on April 27, 2012. Calexico, CA.	Off-duty	4/27/2012
1480	First Run	1480	No action	No action	Orange	200802823	CBP Border Patrol-Agent	BROOKS, TX	ICE detainee claims BPA took her money when she was apprehended and did not send it to her family.	Misconduct	1/5/2008
1619	First Run	1619	No disposition	Disposition not provide	Orange	200803344	CBP Officer	EL PASO, TX	Possible use of official government database to conduct a name query for unofficial purposes	Misconduct	1/18/2008
5766	First Run	5766	No action	No Action	Pink	201303732	CBP Officer	IMPERIAL, CA	CBPO reported his govt issued badge CAR00681 and credentials 54899 lost	Lost equipment / badges	1/24/2013
10212	Second Run	123	Admonishment / reprimand	Written Reprimand	Pink	201306853	CBP Border Patrol-Agent	ORANGE, CA	IPD: BPA - Alleged TECS/ATS Self-Query. San Clemente, CA	Discipline	4/19/2013
2012	First Run	2012	No disposition	Disposition not provided	Blue	200908493	CBP Border Patrol-Agent	CAMERON, TX	Undocumented alien claimed he was pushed by BPA and then recanted.	Misconduct	6/3/2009
10835	Second Run	746	Open	Open disposition pending	Pink	201308610	CBP Border Patrol-Agent	ZAPATA, TX	BPA allegedly not in compliance with CBP policy on outside employment (Zapata TX)	Discipline	5/31/2013
294	First Run	294	Terminated / removed	Termination	Yellow	200600807	CBP Border Patrol-Agent	CAMERON, TX	Escape of Mexican national juvenile from Border Patrol custody	Discipline	11/11/2005
1861	First Run	1861	Terminated / removed	termination	Orange	200804240	CBP Officer	EL PASO, TX	CBPO allegedly involved in suspicious behavior consistent with drug smuggling.	Smuggling	2/21/2008
5424	First Run	5424	Other	With LER	Pink	201302806	CBP Border Patrol-Agent	WEBB, TX	BPA arrested by Laredo PD for Criminal Mischief/Family Violence (Laredo, TX)	Off-duty	12/27/2012
5702	First Run	5702	Admonishment / reprimand	Written Reprimand	Pink	201303581	CBP Border Patrol-Agent	IMPERIAL, CA	BPA struck a safety fence while operating his assigned GOV.	Vehicle	10/21/2012
8890	Second Run	523	No action	No Action	Purple	201205471	CBP Border Patrol-Agent	EL PASO, TX	BPA alleged physical abuse of a detainee, El Paso, TX	Force	2/24/2012
9072	Second Run	705	No action	No Action	Purple	201206017	CBP Border Patrol-Agent	HIDALGO, TX	An unaccompanied juvenile who felt sick was allegedly denied medical attention (McAllen, TX).	Misconduct	3/12/2012
5576	First Run	5576	Admonishment / reprimand	Oral Reprimand	Pink	201303187	CBP Border Patrol-Agent	SANTA CRUZ, AZ	GOV Accident - Service vehicle hit a large mesquite tree	Vehicle	12/12/2012
8982	Second Run	615	No action	No Action	Purple	201205770	CBP Border Patrol-Agent	CAMERON, TX	BPA sister's live-in boyfriend is in the U.S. illegally (Temporary Protected Status overstay). Brownsville, TX.	Association	3/5/2012
321	First Run	321	No action	No Action	Yellow	200600892	CBP Officer	WEBB, TX	, OI/Houston, reported an allegation that an unknown CBPO stationed at the POE/Laredo was facilitating drug smuggling.	Smuggling	11/15/2005
5696	First Run	5696	Invalid case / access denied 	Case # is invalid/access is denied	Pink	201303556	CBP Border Patrol-Agent	WEBB, TX	BPA allegedly involved in an alien smuggling operation, Laredo, TX	Smuggling	1/18/2013
828	First Run	828	No action	No Action	Yellow	200602912	CBP Officer	IMPERIAL, CA	Allowed marijuana laden vehicle for which there was a TECS Lookout to enter the US.	Misconduct	2/16/2006
8979	Second Run	612	No action	No Action	Purple	201205766	CBP Border Patrol-Agent	SANTA CRUZ, AZ	Intentional discharge of service weapon at subject who threw rocks at BPA, Nogales, AZ	Weapon discharge	3/5/2012
1766	First Run	1766	No disposition	Disposition not provide	Orange	200803907	CBP Border Patrol-Agent	COCHISE, AZ	Report of arrest for Bad Check Writing.	Off-duty	2/8/2008
2295	First Run	2295	No action	No Action	Blue	200909278	CBP Border Patrol-Agent	WEBB, TX	Illegal alien alleged he was kicked by unknown BPA after being apprehended.	Force	6/23/2009
8911	Second Run	544	Invalid case / access denied 	Case # is invalid/access is denied	Purple	201205546	CBP Border Patrol-Other Employee	EL PASO, TX	"AMSCO: Mech CORDOVA has a 2004 TECS record for a ""positive K-9 alert.""; addressed in initial BI."	Discipline	6/30/2004
8951	Second Run	584	Invalid case / access denied 	Case # is invalid/access is denied	Purple	201205673	CBP Border Patrol-Agent	JIM HOGG, TX	AMSCO - Positive TECS records: BPA associated w/narcotics smuggling organization. TX	Smuggling	3/1/2012
8021	Second Run	692	No action	No Action	Blue	201000206	CBP Border Patrol- Supervisor	IMPERIAL, CA	Duty Vehicle Rear-Ended	Vehicle	10/5/2009
7546	Second Run	217	No action	No Action	Blue	200911830	CBP Border Patrol-Agent	COCHISE, AZ	Alleged use of excessive force by UDA and delayed notification for pickup and placement	Force	9/3/2009
2996	First Run	2996	No action	No Action	Blue	200911229	CBP Border Patrol-Agent	HIDALGO, NM	Allegation of unintentional firearm discharge, CBP Border Patrol Agent (BPA), Lordsburg, NM.	Weapon discharge	8/15/2009
8450	Second Run	83	No action	No Action	Purple	201204185	CBP Border Patrol-Agent	CAMERON, TX	BPA allegedly involved in off duty physical altercation, Brownsville, TX	Off-duty	1/21/2012
1476	First Run	1476	Resigned	Resigned	Orange	200802812	CBP Border Patrol-Agent	MAVERICK, TX	Arrested on suspicion of Driving While Intoxicated.	Off-duty	1/4/2008
4809	First Run	4809	No action	No Action	Pink	201301277	CBP Border Patrol-Agent	IMPERIAL, CA	BPA arrested by the Imperial, CA, PD for Domestic Violence . Battery, El Centro, CA	Off-duty	11/4/2012
10030	Second Run	1663	No action	No Action	Purple	201208815	CBP Border Patrol-Agent	SAN DIEGO, CA	BRF - On Duty, Government Vehicle, Failure to Exercise Proper Caution While Operating a Government Owned Vehicle (GOV).	Vehicle	4/10/2012
11132	Second Run	1043	Suspension	indefinite suspension	Pink	201309377	CBP Officer	EL PASO, TX	CBPO Arrested for possession of controlled substance, hydrocodone, fraud a third degree felony	Off-duty	2/21/2013
644	First Run	644		Duplicate case; 200602056	Yellow	200602164	CBP Border Patrol-Agent	PIMA, AZ	Allegedly struck alien with barrel of Service weapon during arrest causing cut above left eye that required 2 stitches	Force	1/16/2006
3939	First Run	3939	No action	No Action	Purple	201202054	CBP Border Patrol- Supervisor	HIDALGO, TX	Anonymous allegation that SBPA is aware of drug trafficking activity by some family members. Edinburg, TX.	Association	11/17/2011
8561	Second Run	194	Admonishment / reprimand	Written Reprimand	Purple	201204452	CBP Officer	VAL VERDE, TX	Failure to report to overtime assignments	Discipline	
7256	Second Run	112	No disposition	Disposition not provide	Orange	200804676	CBP Supervisory Officer	EL PASO, TX	Traveler comment card indicated SCBPO was rude, unprofessional, excessive use of authority, El Paso, TX	Misconduct	3/5/2008
9320	Second Run	953	Invalid case / access denied 	Case # is invalid/access is denied	Purple	201206697	CBP Officer	VAL VERDE, TX	A marihuana smuggler claims “drug cartels have people who work for them within CBP at the bridge” (Del Rio, TX).	Smuggling	3/28/2012
2724	First Run	2724	Admonishment / reprimand	Written Reprimand	Blue	200910510	CBP Border Patrol-Agent	Texas	Vehicle Accident (M-74620)	Vehicle	6/24/2009
2881	First Run	2881	No action	No Action	Blue	200910917	CBP Border Patrol-Agent	LA SALLE, TX	Missing BP Body Armor in Cotulla, TX.	Lost equipment / badges	8/12/2009
5287	First Run	5287	Other	With LER	Pink	201302481	CBP Border Patrol-Agent	PIMA, AZ	A BPA allegedly grabbed a UDA's shirt, kicked his foot then slapped his face (Ajo, AZ).	Force	12/12/2012
7690	Second Run	361	Invalid case / access denied 	Case # is invaild/access	Blue	200912295	CBP Border Patrol-Agent	HIDALGO, TX	Allegation of excessive force against an UNKNOWN BPA, McAllen, TX.	Force	9/16/2009
6818	Second Run	6	Admonishment / reprimand	Caution Letter	Yellow	200604290	CBP Officer	SAN DIEGO, CA	Employee had a couple of unauthorized charges on his GOV travel card.	Discipline	4/17/2006
2887	First Run	2887	Other	Alternative Remedy	Blue	200910929	CBP Officer	YUMA, AZ	Allegation against a U.S. Customs and Border Protection Officer (CBPO) for conduct unbecoming a CBP Officer.	Misconduct	2/12/2009
4897	First Run	4897	Invalid case / access denied 	Case # is invalid/access is denied	Pink	201301499	CBP Officer	SAN DIEGO, CA	"RIG has allegedly been repeatedly mistaken for a ""wanted criminal"" when he enters the U.S. (San Ysidro, CA)."	Misconduct	4/9/2011
5375	First Run	5375	Suspension	Suspension	Pink	201302679	CBP Border Patrol- Supervisor	VAL VERDE, TX	SBPA unauthorized use of travel credit card account; Delinquent travel credit card account. Del Rio, TX.	Discipline	12/19/2012
1175	First Run	1175	No action	No Action	Yellow	200604142	CBP Officer	CAMERON, TX	Alleged threats and unprofessional behavior.	Misconduct	4/10/2006
4124	First Run	4124	Suspension	3-Day Suspension	Purple	201202597	CBP Border Patrol-Agent	EL PASO, TX	BPA arrested for Aggravated Assault with a Deadly Weapon, El Paso, TX	Off-duty	12/5/2011
8782	Second Run	415	Open	Open disposition pending	Purple	201205119	CBP Border Patrol-Agent	WEBB, TX	BPA was arrested by Laredo (TX) PD for Making Terrorist Threats, Resisting Arrest/Transportation.	Off-duty	2/15/2012
471	First Run	471	No action	No Action	Yellow	200601428	CBP Border Patrol-Agent	WEBB, TX	"Service K-9 ""Tubby"" was killed while perfroming checkpoint duties"	Discipline	12/12/2005
2097	First Run	2097	No action	No Action	Blue	200908736	CBP Officer	SAN DIEGO, CA	Pornographic Images located on hard drive accessed by subject	Discipline	6/12/2009
5409	First Run	5409	No action	No Action	Pink	201302774	CBP Border Patrol-Agent	DONA ANA, NM	BPA alleged improper Use of Email alleged harassment, Las Cruces, NM	Discipline	12/1/2012
6631	First Run	6631	No action	No Action	Pink	201306079	CBP Border Patrol-Agent	MAVERICK, TX	UDA alleged excessive force by BPA, Eagle Pass, TX.	Force	3/30/2013
9104	Second Run	737	No action	No Action	Purple	201206106	CBP Border Patrol-Agent	KLEBERG, TX	Loss of GPS	Lost equipment / badges	2/19/2012
483	First Run	483	Admonishment / reprimand	Written Reprimand	Yellow	200601457	CBP Border Patrol-Agent	JIM HOGG, TX	Motor Vehicle Accident	Vehicle	10/31/2005
3625	First Run	3625	Agency denied	Grievance Denied	Purple	201201022	CBP Border Patrol-Agent	YUMA, AZ	Step III Grievance; Employee Alleges Denial of Representation While Required to Submit a Written Statement in the Form of a Memorandum.	Discipline	9/21/2011
11023	Second Run	934	No action	No Action	Pink	201309124	CBP Border Patrol-Agent	STARR, TX	Attendance & Leave Issues	Discipline	6/12/2013
758	First Run	758	Invalid case / access denied 	Case # is invalid/access is denied	Yellow	200602609	CBP Border Patrol-Agent	COCHISE, AZ	Alleged misuse of gov't time, safety issues and alleged harassent.	Discipline	2/6/2006
10735	Second Run	646	Admonishment / reprimand	Written Reprimand	Pink	201308329	CBP Border Patrol-Agent	COCHISE, AZ	Disciplinary GOV Accident	Vehicle	4/20/2013
2817	First Run	2817	Terminated / removed	Termination	Blue	200910745	CBP Border Patrol-Agent	SANTA CRUZ, AZ	Vehicle accident - Intern	Vehicle	7/22/2009
3825	First Run	3825	Suspension	5-Day Suspension	Purple	201201705	CBP Border Patrol-Agent	CLARK, NV	misuse of government issued credit card	Discipline	11/9/2011
10694	Second Run	605	No action	No Action	Pink	201308209	CBP Border Patrol-Agent	SAN DIEGO, CA	CHU BPA allegedly physically abused a UDA during apprehension, as well as denied the alien medical attention	Force	2/19/2013
8494	Second Run	127	Admonishment / reprimand	Written Reprimand	Purple	201204272	CBP Border Patrol-Agent	SAN DIEGO, CA	On-duty, government property, vehicle accident	Vehicle	1/25/2012
400	First Run	400	Invalid case / access denied 	Case # is invalid/access is denied	Yellow	200601194	CBP Border Patrol-Agent	STARR, TX	Use of force to subdue a combative individual	Force	11/29/2005
9737	Second Run	1370	No action	No Action	Purple	201208021	CBP Officer	YUMA, AZ	UNIDENTIFIED CBPO PROVIDING IMMIGRATION DOCUMENTS TO ALIEN SMUGGLER. San Luis, AZ.	Misconduct	4/26/2012
1027	First Run	1027	Suspension	2 Day Suspension	Yellow	200603628	CBP Border Patrol- Supervisor	KLEBERG, TX	ALLEGED MISUSE OF GOVERNMENT OWNED VEHICLE.	Vehicle	3/17/2006
4163	First Run	4163	Admonishment / reprimand	Written Reprimand	Purple	201202685	CBP Border Patrol-Agent	DONA ANA, NM	Credi Card - Failure to pay balance in full on time	Discipline	8/12/2011
5497	First Run	5497	Counseling	Formal Counseling	Pink	201302979	CBP Officer	MAVERICK, TX	CBPO allegedly charged 17 ghost I-94 permits in order to balance the daily cash register deposit (Eagle Pass, TX).	Discipline	12/28/2012
7155	Second Run	11	No action	No action	Orange	200804312	CBP Border Patrol-Agent	COCHISE, AZ	BPA arrested for allegedly providing false information to a police officer	Off-duty	2/25/2008
10816	Second Run	727	No action	No Action	Pink	201308553	CBP Border Patrol-Agent	HIDALGO, TX	Lost Equipment	Lost equipment / badges	4/30/2013
7961	Second Run	632	Admonishment / reprimand	Reprimand	Blue	201000057	CBP Officer	EL PASO, TX	Employee failed to follow instructions.	Discipline	7/20/2009
10980	Second Run	891	No action	No Action	Pink	201309018	CBP Border Patrol- Supervisor	DONA ANA, NM	SBPA allegedly harassing private citizens; possible misuse of CBP resources Las Cruces NM	Misconduct	6/10/2013
3304	First Run	3304	Admonishment / reprimand	Written Reprimand	Purple	201114116	CBP Border Patrol-Agent	IMPERIAL, CA	BPA struck a stationary Calexico Police Department sedan while operating his assigned GOV.	Vehicle	8/24/2011
11154	Second Run	1065	No action	No Action	Pink	201309441	CBP Border Patrol-Agent	IMPERIAL, CA	Off-duty BPA PRYOR allegedly threatened to shoot another off-duty BPA Imperial CA	Off-duty	6/9/2013
4386	First Run	4386	No action	No Action	Purple	201203282	CBP Border Patrol-Other Employee	IMPERIAL, CA	MM is allegedly creating a hostile work environment towards another employee. El Centro, CA	Discipline	12/19/2011
4450	First Run	4450	Admonishment / reprimand	Written Reprimand	Purple	201203437	CBP Border Patrol- Supervisor	RIVERSIDE, CA	STOLEN LAPTOP	Lost equipment / badges	10/25/2011
6263	First Run	6263	No action	No Action	Pink	201304972	CBP Officer	SANTA CRUZ, AZ	CBPO allegedly engaged in misconduct of a sexual nature while on duty. (Nogales, AZ)	Misconduct	2/27/2013
4472	First Run	4472	Admonishment / reprimand	Written Reprimand	Purple	201203509	CBP Border Patrol-Agent	MAVERICK, TX	On-Duty, BPA struck a cow while driving his assigned GOV, Eagle Pass, TX	Vehicle	1/4/2012
5758	First Run	5758	Invalid case / access denied 	Case # is invalid/access is denied	Pink	201303719	CBP Border Patrol-Agent	BROOKS, TX	Unknown BPA assigned to the BP/Falfurrias checkpoint allegedly facilitating the smuggling of UDAs. Falfurrias, TX.	Misconduct	1/23/2013
6759	First Run	6759	No action	No Action	Pink	201306389	CBP Border Patrol-Agent	SAN DIEGO, CA	Alien claimed he was physically abused by BPA (Imperial Beach, CA)	Force	4/8/2013
4621	First Run	4621	Suspension	14-Day Suspension	Purple	201203918	CBP Border Patrol-Agent	EL PASO, TX	BPA arrested by EPPD for Reckless Driving on January 13, 2012. El Paso, TX.	Off-duty	1/13/2012
5460	First Run	5460	Counseling	Counseling	Pink	201302880	CBP Officer	BEE, TX	CBPO was reportedly arrested for Driving While Intoxicated, Beeville, TX.	Off-duty	12/26/2012
7819	Second Run	490	Admonishment / reprimand	Reprimand	Blue	200912609	CBP Border Patrol-Agent	PIMA, AZ	Information received regarding Official Use Only documents being sent to an AOL account	Discipline	9/23/2009
4974	First Run	4974	No action	No Action	Pink	201301692	CBP Border Patrol- Supervisor	GOLIAD, TX	SBPA allegedly harassing citizen and possibly queried government database about citizen, Laredo, TX.	Misconduct	11/16/2012
6813	Second Run	1	Invalid case / access denied 	Case # is invalid/access is denied	Yellow	200604275	CBP Officer	IMPERIAL, CA	Arrested on 4/16/06 for Public Intoxication and Battery.	Off-duty	4/17/2006
3957	First Run	3957	Invalid case / access denied 	Case # is invalid/access is denied	Purple	201202103	CBP Border Patrol-Agent	CAMERON, TX	Allegation of facilitation smuggling of narcotics by BPA , Harlingen, TX.	Smuggling	11/20/2011
5085	First Run	5085	Invalid case / access denied 	Case # is invalid/access is denied	Pink	201301954	CBP Border Patrol- Supervisor	BROOKS, TX	Alleged inappropriate contact with UDA (Sexual advances; Offered UDA assistance in asylum process), Falfurrias, TX	Misconduct	11/28/2012
10752	Second Run	663	Admonishment / reprimand	Written Reprimand	Pink	201308372	CBP Border Patrol-Agent	SAN DIEGO, CA	CHU IPD: BPA - Alleged TECS/ATS self-query - Chula Vista, CA	Discipline	10/20/2012
9232	Second Run	865	No action	No Action	Purple	201206461	CBP Border Patrol- Supervisor	COCHISE, AZ	SBPA alleged misperformance of duties, Douglas, AZ	Discipline	3/22/2012
9753	Second Run	1386	Admonishment / reprimand	Written Reprimand	Purple	201208082	CBP Canine Enforcement Officer	EL PASO, TX	Vehicle Accident/Careless Operation of GOV	Vehicle	10/6/2011
7703	Second Run	374	Invalid case / access denied 	Case # is invaild/access	Blue	200912321	CBP Border Patrol-Agent	SAN DIEGO, CA	BPA Intern arrested by CHP for Driving Under the Influence (DUI)	Off-duty	9/17/2009
8623	Second Run	256	No action	No Action	Purple	201204661	CBP Border Patrol-Agent	EL PASO, TX	BPA allegedly has ties to an alien smuggler. TX	Association	2/3/2012
3967	First Run	3967	Suspension	1-Day Suspension	Purple	201202141	CBP Border Patrol-Agent	HIDALGO, TX	motor vehicle accident M 73784	Vehicle	11/21/2011
8052	Second Run	723	Counseling	Counseling	Blue	201000306	CBP Border Patrol-Agent	COCHISE, AZ	Reported escape of UDA	Misconduct	10/8/2009
8559	Second Run	192	No action	No Action	Purple	201204446	CBP Border Patrol-Agent	MAVERICK, TX	"A narcotics smuggler "" allegedly has BPAs on the payroll, Rio Grande Valley Sector, TX"	Smuggling	1/30/2012
1155	First Run	1155	Admonishment / reprimand	Written Reprimand	Yellow	200604047	CBP Border Patrol-Agent	MAVERICK, TX	Subj went home to pick up forgotten wallet, found wife/movers packing BP prop	Association	12/13/2005
1328	First Run	1328	No action	No action	Orange	200802286	CBP Border Patrol-Agent	PINAL, AZ	BPA reported his duty weapon was stolen from his residence, weapon has been recovered, AZ.	Lost equipment / badges	12/10/2007
4320	First Run	4320	Counseling	Counseling	Purple	201203117	CBP Officer	SAN DIEGO, CA	on duty, unprofessional conduct, CBPO made a comment a traveler found to be threatening and disregarded an SCBPO's instructions. San Ysidro, CA	Misconduct	12/19/2011
4842	First Run	4842	Other	MGMT Research	Pink	201301379	CBP Officer	MAVERICK, TX	Disreputable association with persons related to weapons investigation; Possible corrupt CBPO. Eagle Pass, TX.	Association	11/7/2012
2778	First Run	2778	Invalid case / access denied 	Case # is invalid/access is denied	Blue	200910675	CBP Officer	SAN DIEGO, CA	INFORMATION ONLY - former CBPO alleges poor work by CBPO	Discipline	8/4/2009
612	First Run	612		Duplicate case; 200601183	Yellow	200602045	CBP Officer	EL PASO, TX	Complaint of Hostile Work Environment against	Discipline	1/11/2006
7369	Second Run	40	No disposition	Disposition not provided	Blue	200911374	CBP Border Patrol-Agent	HUDSPETH, TX	Alleged drug use and inappropriate behavior by BPA	Off-duty	8/24/2009
8211	Second Run	882	Terminated / removed	Termination	Blue	201000798	CBP Border Patrol-Agent	BREWSTER, TX	Alpine, Tx Police PD alleges BPA displays unprofessional demeanor.	Misconduct	8/14/2009
9025	Second Run	658	No action	No Action	Purple	201205879	CBP Border Patrol-Agent	IMPERIAL, CA	BPA passing narcotics through a POE without following established law enforcement guidelines. Calexico, CA	Smuggling	3/7/2012
11157	Second Run	1068	Open	Open disposition pending	Pink	201309448	CBP Border Patrol-Agent	SAN DIEGO, CA	CHU BPA allegedly makes inappropriate comments to females; may be unstable and a safety threat	Discipline	6/20/2013
2108	First Run	2108	No action	No Action	Blue	200908753	CBP Border Patrol-Agent	YUMA, AZ	Unintentional discharge of service weapon - No injuries	Weapon discharge	6/15/2009
3529	First Run	3529	No action	No Action	Purple	201200686	CBP Border Patrol-Agent	PIMA, AZ	Alien complained to Mexican Consulate that he was detained in Tucson for three days before being brought to Nogales	Misconduct	10/19/2011
5480	First Run	5480	Suspension	5 Day Suspension	Pink	201302930	CBP Border Patrol-Agent	CAMERON, TX	BPA reported for work intoxicated, Harlingen, TX.	Discipline	12/29/2012
4448	First Run	4448	No action	No Action	Purple	201203435	CBP Border Patrol-Agent	COCHISE, AZ	BPA involved in intentional shooting with personal weapon against neighbor's dog	Off-duty	12/29/2011
2282	First Run	2282	Counseling	Counseling	Blue	200909253	CBP Border Patrol-Agent	COCHISE, AZ	BPA (Intern) Lost his GPS Unit	Lost equipment / badges	6/15/2009
2581	First Run	2581	No action	No Action	Blue	200910131	CBP Border Patrol-Agent	BROOKS, TX	Civilian Complaint Against Border Patrol Agent (BPA) in Falfurrias, TX	Force	7/18/2009
3767	First Run	3767	No action	No Action	Purple	201201507	CBP Border Patrol-Agent	PIMA, AZ	AMSCO: BPA has a TECS record indicating he may be associated with a drug trafficking organization (DTO). Tucson, AZ	Association	2/25/2011
4674	First Run	4674	Admonishment / reprimand	Oral Reprimand	Pink	201300938	CBP Border Patrol-Agent	SANTA CRUZ, AZ	BPA allegedly falsifying T&A, misusing GOV and equipment, and sleeping on the job. (Nogales, AZ)	Discipline	10/24/2012
8984	Second Run	617	No action	No Action	Purple	201205774	CBP Border Patrol- Supervisor	TERRELL, TX	Medical Case - Fitness for Duty Exam	Discipline	2/23/2012
7839	Second Run	510	Suspension	1 Day Suspension	Blue	200912676	CBP Border Patrol-Agent	CAMERON, TX	Allegation of Unauthorized Use of Government Email	Misconduct	9/22/2009
5265	First Run	5265	Other	decision issued	Pink	201302421	CBP Border Patrol-Agent	BROOKS, TX	AMSCO: BPA allegedly changed a license plate in computer system to clear a vehicle for entry with a TECS alert, Falfurrias, TX	Misconduct	10/25/2012
3817	First Run	3817	Open	Remains Open	Purple	201201684	CBP Border Patrol-Agent	WEBB, TX	BPA Off-duty arrest for Reckless Driving. Laredo, TX	Off-duty	11/9/2011
11098	Second Run	1009	Counseling	counseling	Pink	201309315	CBP Border Patrol-Agent	WEBB, TX	Failure to acknowledge to Mid-Year work appraisal in the Performance Management Tracking System	Discipline	4/1/2013
8887	Second Run	520	Admonishment / reprimand	Written Reprimand	Purple	201205463	CBP Border Patrol- Supervisor	YUMA, AZ	FOS unintentional discharge of service weapon (#W314813) no damage or injuries, Wellton, AZ	Weapon discharge	2/24/2012
4396	First Run	4396	Suspension	3-Day Suspension	Purple	201203313	CBP Border Patrol-Agent	YUMA, AZ	BPA arrested by Yuma PD for DUI and Hit and Run, Yuma, AZ.	Off-duty	12/27/2011
8545	Second Run	178	Admonishment / reprimand	Oral Reprimand	Purple	201204413	CBP Border Patrol-Agent	YUMA, AZ	Lost body armor (S/N: BABP785970610)	Lost equipment / badges	1/30/2012
5096	First Run	5096	No action	No Action	Pink	201301983	CBP Border Patrol-Agent	SAN DIEGO, CA	BPA allegedly assaulted a woman then arrested her without cause (Imperial Beach, CA).	Force	8/28/2011
