id	run	counter	disposition_cleaned	disposition	color	caseid	subject	location	summary	Initial_category	date
1903	First Run	1903	Invalid case / access denied 	Case # is invalid/access is denied	Blue	200908178	CBP Border Patrol-Agent	SAN DIEGO, CA	Alleged excessive use of force.	Force	5/28/2009
7036	Second Run	224	No disposition	Disposition not provided	Yellow	200605064	CBP Officer	EL PASO, TX	CBPO - Lost badge	Lost equipment / badges	5/19/2006
8495	Second Run	128	Suspension	2-Day Suspension	Purple	201204273	CBP Border Patrol-Agent	SAN DIEGO, CA	On-duty, neglect of duty, sleeping on duty	Discipline	1/25/2012
9890	Second Run	1523	Admonishment / reprimand	Written Reprimand	Purple	201208454	CBP Border Patrol-Agent	SAN DIEGO, CA	ON DUTY/GOVERNMENT VEHICLE/FAILURE TO EXERCISE PROPER CAUTION WHILE OPERATING A GOVERNMENT VEHICLE	Vehicle	5/9/2012
6101	First Run	6101	Counseling	Counseling	Pink	201304606	CBP Border Patrol-Agent	IMPERIAL, CA	BPA allegedly crossed border in a car with former BPA later arrested for drug smuggling. (Calexico, CA)	Smuggling	11/7/2010
9877	Second Run	1510	Invalid case / access denied 	Case # is invalid/access is denied	Purple	201208409	CBP Border Patrol-Agent	KLEBERG, TX	PIG: Alleged corruption involving BPA Kingsville, TX	Misconduct	5/9/2012
10859	Second Run	770	Counseling	counseling	Pink	201308685	CBP Border Patrol-Agent	EL PASO, TX	BPA allegedly disclosed the identity of an FBI confidential informant. El Paso, TX	Misconduct	5/31/2013
3374	First Run	3374	Other	Employee cleared to full duty by his doctor	Purple	201200168	CBP Border Patrol-Agent	LUNA, NM	Fitness for Duty	Discipline	10/29/2010
2163	First Run	2163	No disposition	Disposition not provided	Blue	200908883	CBP Border Patrol-Agent	WEBB, TX	BPA unintentional discharge of weapon	Weapon discharge	6/18/2009
8822	Second Run	455	Admonishment / reprimand	Written Reprimand	Purple	201205255	CBP Border Patrol-Agent	WEBB, TX	DISCIPLINE - Vehicle Accident Involving (M97296)	Vehicle	1/7/2012
3996	First Run	3996	Other	Returned to full duty	Purple	201202206	CBP Supervisory Officer	IMPERIAL, CA	Medical - Employee is no longer physicall capable of performing CBPO duties due to medical	Discipline	11/4/2011
1748	First Run	1748	No disposition	Disposition not provide	Orange	200803810	CBP Officer	CAMERON, TX	Alleged alien and narcotics smuggling by CBPO Brownsville, TX.	Smuggling	1/17/2008
3113	First Run	3113	No action	No Action	Purple	201113492	CBP Border Patrol-Agent	PINAL, AZ	CRCL Referred Complaint 10-08-CBP-0119 - Alleged verbal and physical abuse and manipulation of statement	Force	9/19/2011
8604	Second Run	237	Agency denied	Agency denied Step II	Purple	201204606	CBP Border Patrol-Agent	ZAPATA, TX	Grievance- Formal Counseling BPA	Discipline	
4895	First Run	4895	Counseling	Counseling	Pink	201301489	CBP Border Patrol-Agent	WEBB, TX	BPA reportedly found asleep & possibly intoxicated in his POV by Webb County SO deputies	Off-duty	11/11/2012
2254	First Run	2254	Invalid case / access denied 	Case # is invalid/access is denied	Blue	200909189	CBP Officer	KINNEY, TX	CBPO cited for No Insurance (vehicle) by Kinney Co., TX, Sheriff's Department, Brackettville, IX	Off-duty	6/16/2009
1762	First Run	1762	Admonishment / reprimand	Written Reprimand	Orange	200803892	CBP Supervisory Officer	IMPERIAL, CA	Supervisory Officer was unprofessinal with a Watch Commander.	Discipline	2/7/2008
8514	Second Run	147	Suspension	1-Day Suspension	Purple	201204341	CBP Border Patrol-Agent	IMPERIAL, CA	BPA failed to negotiate a turn, causing his assigned GOV to roll and strike a wooden telephone poll.	Vehicle	9/4/2011
6600	First Run	6600	Invalid case / access denied 	Case # is invalid/access denied	Pink	201305984	CBP Border Patrol-Agent	SANTA CRUZ, AZ	UDA alleged BPA pushed him to the ground and kneed him in the back, Nogales, AZ.	Force	3/26/2013
5141	First Run	5141	No action	No Action	Pink	201302084	CBP Border Patrol-Agent	WEBB, TX	Alien claimed he was assaulted during apprehension and later recanted	Force	12/1/2012
6233	First Run	6233	Other	with LER	Pink	201304921	CBP Border Patrol- Supervisor	HIDALGO, TX	SBPA reportedly owns rental property which is associated with a money laundering investigation (McAllen, TX).	Association	2/26/2013
654	First Run	654	Invalid case / access denied 	Case # is invalid/access is denied	Yellow	200602198	CBP Officer	CAMERON, TX	Alleged alien smuggling by unknown CBPO, Brownsville, TX.	Smuggling	1/19/2006
10347	Second Run	258	Counseling	counseling	Pink	201307239	CBP Border Patrol-Agent	WEBB, TX	BPA J did not arrive to work on time as scheduled.	Discipline	2/13/2013
7294	Second Run	150	Invalid case / access denied 	case # is invalid/access is denied	Orange	200804821	CBP Border Patrol-Agent	OTERO, NM	Allegedly assisting a DTO smuggle narcotics through the Highway 54 BP Checkpoint	Smuggling	3/7/2008
7286	Second Run	142	No action	No action	Orange	200804754	CBP Border Patrol-Agent	SAN DIEGO, CA	REMAND NOV 2010 Alleged inappropriate relationship with a detained alien.	Association	3/6/2008
4744	First Run	4744	No action	No Action	Pink	201301126	CBP Border Patrol-Agent	VAL VERDE, TX	BPA allegedly once owned a vehicle observed engaging in suspicious activity. (Del Rio, TX)	Association	10/29/2012
4828	First Run	4828	No action	No Action	Pink	201301319	CBP Border Patrol-Agent	VAL VERDE, TX	BPA was issued a speeding citation while on duty and driving a GOV Del Rio TX	Vehicle	10/29/2012
10876	Second Run	787	Open	Open disposition pending	Pink	201308717	CBP Officer	CAMERON, TX	RIG: Civilian claimed medication was illegally seized at the border in 2003 (Brownsville TX)	Misconduct	6/4/2013
7929	Second Run	600	Admonishment / reprimand	Reprimand	Blue	200912876	CBP Border Patrol-Agent	SAN DIEGO, CA	VEHICLE ACCIDENT - TIPPED VEHICLE OVER	Vehicle	7/2/2009
9075	Second Run	708	Invalid case / access denied 	Case # is invalid/access is denied	Purple	201206022	CBP Officer	SAN DIEGO, CA	Derogatory information disclosed during CBPO's daughter's application for employment with CBP, Tecate, CA	Discipline	3/12/2012
4097	First Run	4097	No action	No Action	Purple	201202510	CBP Border Patrol- Supervisor	PRESIDIO, TX	BPA Speaks alleges he is being retaliated against for previous EEO and complaints he has submitted, Presidio, TX	Discipline	12/1/2011
4302	First Run	4302	Suspension	1-Day Suspension	Purple	201203056	CBP Border Patrol-Agent	WEBB, TX	BPA allegedly has an active arrest warrant related to an unpaid speeding ticket, Laredo, TX	Off-duty	12/16/2011
5671	First Run	5671	No action	No Action	Pink	201303493	CBP Border Patrol-Agent	CAMERON, TX	SIR reports BPA assaulted by an intruder in his residence and local PD responded. (Brownsville, TX)	Discipline	1/14/2013
4767	First Run	4767	Invalid case / access denied 	Case # is invalid/access is denied	Pink	201301167	CBP Officer	WEBB, TX	CBPO contacted by neighbor who inquired about a detained shipment, Laredo, TX.	Off-duty	10/30/2012
7947	Second Run	618	No action	No Action	Blue	201000019	CBP Border Patrol-Agent	WEBB, TX	BPA Intern alleged workplace harassment and hazing tactics by SBPAÆs	Discipline	10/1/2009
982	First Run	982	Suspension	1 Day Suspension Suspension	Yellow	200603451	CBP Border Patrol-Agent	HIDALGO, TX	off-duty misconduct (arrest for DUI & charged w/ public intoxication)	Off-duty	3/13/2006
3046	First Run	3046	No action	No Action	Purple	201113296	CBP Officer	SANTA CRUZ, AZ	Alleged association with the subject of a TECS hit	Association	9/13/2011
9976	Second Run	1609	Counseling	Counseling	Purple	201208687	CBP Border Patrol-Agent	SAN DIEGO, CA	CHU - On duty, Equipment/Property - Government, Failure to Properly Safeguard Government Issued Property.	Lost equipment / badges	5/16/2012
9766	Second Run	1399	No action	No Action	Purple	201208114	CBP Officer	WEBB, TX	CBPO alleged failure properly to perform official duties. Laredo, TX.	Discipline	5/2/2012
4519	First Run	4519	Admonishment / reprimand	Written Reprimand	Purple	201203613	CBP Border Patrol-Agent	EL PASO, TX	Failure to Pay Financial Obligations	Discipline	7/20/2011
3686	First Run	3686	Invalid case / access denied 	Case # is invalid/access is denied	Purple	201201202	CBP Border Patrol-Agent	CAMERON, TX	A USC who did not stop at a BP checkpoint alleges he was subjected to excessive force by his arresting BPAs. Brownsville, TX	Force	10/29/2011
2428	First Run	2428	No action	No Action	Blue	200909684	CBP Border Patrol-Agent	IMPERIAL, CA	USC alleged BPA is harassing his son and his rights are being violated	Association	7/10/2009
8736	Second Run	369	Counseling	Counseling	Purple	201204994	CBP Border Patrol-Agent	COCHISE, AZ	BPA - Failure to Follow Policy	Discipline	2/9/2012
1533	First Run	1533	No action	No action	Orange	200803058	CBP Border Patrol-Agent	WEBB, TX	"Allegations of disreputable association against BPA named ""."	Association	1/11/2008
7311	Second Run	167	No action	No action	Orange	200804882	CBP Border Patrol-Agent	WEBB, TX	Alleged drug use right before entering BP Academy; allegedly dating a 15 year old until December 2007.	Discipline	3/11/2008
8543	Second Run	176	Suspension	1-Day Suspension	Purple	201204410	CBP Border Patrol-Agent	DUVAL, TX	BPA Service canine escaped from its enclosure and attacked and injured another Service canine, Duval, TX.	Discipline	1/28/2012
9568	Second Run	1201	No action	No Action	Purple	201207441	CBP Border Patrol-Agent	UNKNOWN-UNK	BPA alleged inappropriate romantic relationship with a narcotics smuggler, Douglas, AZ, area	Association	4/17/2012
2211	First Run	2211	Suspension	7 Day Suspension	Blue	200909056	CBP Border Patrol- Supervisor	JIM HOGG, TX	Alleged harassment of a contract employee	Discipline	6/23/2009
4768	First Run	4768	No action	No Action	Pink	201301170	CBP Port Directors & Assistant Port-Directors	CAMERON, TX	APD reported his wife may owe the IRS back taxes for a business she previously owned. Business no longer exists.	Association	11/1/2012
2476	First Run	2476	Counseling	Counseling	Blue	200909825	CBP Border Patrol-Agent	WEBB, TX	Vehicle Accident Involving K3046	Vehicle	5/6/2009
8686	Second Run	319	Admonishment / reprimand	Written Reprimand	Purple	201204818	CBP Border Patrol-Agent	KLEBERG, TX	Loss of Government Equipment (GPS) C1613491	Lost equipment / badges	1/12/2012
3508	First Run	3508	No action	No Action	Purple	201200642	CBP Border Patrol- Supervisor	WEBB, TX	Branch Chief (Communications) is using Facebook, a social media, to harass a civilian. Laredo, TX	Misconduct	10/18/2011
6190	First Run	6190	No action	No Action	Pink	201304821	CBP Border Patrol-Agent	EL PASO, TX	BPAüfs motherüfs reported birth in the U.S. may not be factual; BPA may not be a USC (El Paso, TX).	Association	2/22/2013
9619	Second Run	1252	No action	No Action	Purple	201207627	CBP Border Patrol- Supervisor	IMPERIAL, CA	AMSCO: SBPA has an April 2012 TECS record indicating he is associated with an address where drugs are sold (Calexico, CA).	Association	4/19/2012
2849	First Run	2849	Invalid case / access denied 	Case # is invalid/access is denied	Blue	200910819	CBP Border Patrol-Agent	EL PASO, TX	Incident between a CBP Border Patrol Agent's father and El Paso County Sheriff's Office.	Association	7/27/2009
7328	Second Run	184	No action	No action	Orange	200804943	CBP Border Patrol- Supervisor	VAL VERDE, TX	Alleged falsification and retaliation	Discipline	3/13/2008
8527	Second Run	160	No action	No Action	Purple	201204367	CBP Border Patrol-Agent	SAN DIEGO, CA	BRF - On Duty, Government Vehicle, Failure to Exercise Proper Caution While Operating a Government Owned Vehicle (GOV).	Vehicle	12/9/2011
3676	First Run	3676	Invalid case / access denied 	Case # is invalid/access is denied	Purple	201201157	CBP Officer	IMPERIAL, CA	CBPO Alleged disclosure of TECS information to subjects of TECS records. Calexico, CA.	Discipline	10/28/2011
6176	First Run	6176	Counseling	Counseling	Pink	201304794	CBP Border Patrol-Agent	DONA ANA, NM	"BPA allegedly having ""sit down meal"" while on duty during AUO. Las Cruces, NM"	Discipline	2/20/2013
2973	First Run	2973	No action	No Action	Blue	200911158	CBP Border Patrol-Agent	HUDSPETH, TX	Small bag of cocaine found in the computer processing area of the BP Checkpoint west of Sierra Blanca, TX.	Association	8/9/2009
9948	Second Run	1581	Invalid case / access denied 	Case # is invalid/access is denied	Purple	201208614	CBP Officer	YUMA, AZ	CBPO , SLU/POE, was denied a new SENTRI card due to a link to an alien smuggling incident. San Luis, AZ	Smuggling	5/14/2012
10806	Second Run	717	Closed	closed-Resigned	Pink	201308536	CBP Border Patrol-Agent	MAVERICK, TX	BPA reports lost badge 0 and credential . (Eagle Pass, TX)	Lost equipment / badges	5/27/2013
375	First Run	375	No action	No Action	Yellow	200601095	CBP Border Patrol-Agent	SAN DIEGO, CA	Missing property. Alien alleged that his backback that allegedly contained $360 was missing	Misconduct	11/25/2005
8540	Second Run	173	No action	No Action	Purple	201204406	CBP Border Patrol- Supervisor	PIMA, AZ	A UDA ran into the highway in front of a marked BP vehicle; received a minor injury after hitting the vehicle, Why, AZ.	Discipline	1/27/2012
10183	Second Run	94	Open	Open disposition pending	Pink	201306745	CBP Border Patrol-Agent	PIMA, AZ	BPA arrested by Tucson PD for Driving Under the Influence (DUI), Tucson AZ	Off-duty	4/17/2013
11185	Second Run	1096	No action	No Action	Pink	201309549	CBP Officer	EL PASO, TX	CBPO: Alleged disreputable association, El Paso, TX	Association	6/24/2013
7906	Second Run	577	No action	No Action	Blue	200912826	CBP Supervisory Officer	IMPERIAL, CA	Alleged investigation disclosure by APD	Discipline	9/25/2009
8729	Second Run	362	Admonishment / reprimand	Oral Reprimand	Purple	201204976	CBP Border Patrol-Agent	PIMA, AZ	BPA involved in a GOV Accident	Vehicle	1/13/2012
5795	First Run	5795	No action	No Action	Pink	201303820	CBP Border Patrol-Agent	EL PASO, TX	Estranged spouse claimed BPA is sending harassing text messages and following her Ysleta, TX	Off-duty	1/28/2013
4829	First Run	4829	Invalid case / access denied 	Case # is invalid/access is denied	Pink	201301321	CBP Border Patrol-Agent	BROOKS, TX	Employee at Falfurrias checkpoint allegedly assisting couriers to pass narcotics through the checkpoint	Smuggling	11/5/2012
2755	First Run	2755	Admonishment / reprimand	Written Reprimand	Blue	200910598	CBP Officer	SAN DIEGO, CA	Report of arrest for DUI.	Off-duty	8/3/2009
10204	Second Run	115	Invalid case / access denied 	case number is invalid or access is denied	Pink	201306825	CBP Border Patrol-Agent	JIM HOGG, TX	BPA possibly involved in a disreputable association, Hebbronville, TX	Association	4/16/2013
1366	First Run	1366	Invalid case / access denied 	Case # is invalid/access is denied	Orange	200802432	CBP Border Patrol-Agent	PIMA, AZ	Allegation that BPAs pulled over local resident, drew weapons, traveler feared exiting vehicle	Force	12/14/2007
2967	First Run	2967	Admonishment / reprimand	Written Reprimand	Blue	200911144	CBP Border Patrol-Agent	SAN DIEGO, CA	ROI - BLV - Allegation of inappropriate search and unprofessional behavior,U.S. Customs and Border Protection (CBP) Border Patrol Agent.	Misconduct	2/23/2009
3417	First Run	3417	No action	No Action	Purple	201200317	CBP Officer	VAL VERDE, TX	CBPO takes a long time to inspect women's purses and allegedly took money from one person. Del Rio, TX	Misconduct	10/11/2011
2892	First Run	2892	No action	No Action	Blue	200910944	CBP Border Patrol-Agent	PIMA, AZ	Alleged physical abuse of a juvenile datainee	Force	8/12/2009
6224	First Run	6224	No action	No Action	Pink	201304895	CBP Border Patrol-Agent	HIDALGO, TX	BPA self-reports his girlfriendüfs family may have been the subjects of a search warrant. (Weslaco, TX)	Association	2/23/2013
6592	First Run	6592	Invalid case / access denied 	Case # is invalid/access denied	Pink	201305970	CBP Border Patrol-Other Employee	PIMA, AZ	RIG: Civilian alleges gross waste of CBP funds in Ajo, AZ	Misconduct	3/27/2013
8243	Second Run	914	No action	No Action	Blue	201000885	CBP Officer	JEFFERSON, TX	Indicted and arrested for violating 18 USC 201 and 18 USC 1001	Off-duty	
6332	First Run	6332	Admonishment / reprimand	Written Reprimand	Pink	201305183	CBP Border Patrol-Agent	IMPERIAL, CA	Agent was involved in a vehicle accident for which he was found at fault	Vehicle	3/6/2013
8954	Second Run	587	Suspension	2-Day Suspension	Purple	201205681	CBP Border Patrol-Agent	SAN DIEGO, CA	BRF - On duty, Equipment/Property - Government, Failure to Properly Safeguard Government Issued Property.	Lost equipment / badges	3/1/2012
2329	First Run	2329	Terminated / removed	Termination during Trial Period	Blue	200909407	CBP Border Patrol-Agent	VAL VERDE, TX	Termination during trial period (failed law exam re-take).	Discipline	7/1/2009
1154	First Run	1154	Suspension	2 Day Suspension	Yellow	200604044	CBP Border Patrol-Agent	IMPERIAL, CA	Unintentional discharge of service weapon	Weapon discharge	4/6/2006
7985	Second Run	656	Suspension	10 Day Suspension	Blue	201000116	CBP Border Patrol-Agent	PIMA, AZ	BPA arrested for Driving Under the Influence	Off-duty	10/4/2009
6827	Second Run	15	No action	No Action	Yellow	200604318	CBP Border Patrol-Agent	EL PASO, TX	A confidential source alleged that BPA might be involved in drug and/or alien smuggling	Smuggling	4/18/2006
3267	First Run	3267	Invalid case / access denied 	Case # is invalid/access is denied	Purple	201113999	CBP Border Patrol- Supervisor	JIM HOGG, TX	SBPA allegedly smuggles or assists in the smuggling of marijuana and ügHigh Value Humans,üh Hebbronville, TX.	Smuggling	9/29/2011
10411	Second Run	322	Open	Open disposition pending	Pink	201307392	CBP Officer	EL PASO, TX	CBPO reports lost body armor. (El Paso, TX)	Lost equipment / badges	5/2/2013
3546	First Run	3546	Admonishment / reprimand	Written Reprimand	Purple	201200728	CBP Border Patrol-Agent	SANTA CRUZ, AZ	Lost GPS	Lost equipment / badges	9/18/2011
11026	Second Run	937	Admonishment / reprimand	Written Reprimand	Pink	201309128	CBP Border Patrol-Agent	HIDALGO, TX	Failure to exercise due caution while operating a GOV (M-25589)	Vehicle	12/12/2012
512	First Run	512	Resigned	Resigned	Yellow	200601593	CBP Officer	EL PASO, TX	Bribery and conspiracy to import a controlled substance	Smuggling	12/20/2005
2885	First Run	2885	Invalid case / access denied 	Case # is invalid/access is denied	Blue	200910926	CBP Officer	CAMERON, TX	Allegation of previous relationship between U.S. Customs and Border Protection Officer (CBPO) and the sister of an arrested subject.	Association	8/6/2009
5850	First Run	5850	No action	No Action	Pink	201303960	CBP Officer	EL PASO, TX	CBPO relative possible involvement in illegal activity, El Paso, TX	Association	1/30/2013
9308	Second Run	941	No action	No Action	Purple	201206660	CBP Supervisory Officer	SAN DIEGO, CA	"magazines being delivered to San Ysidro POE using the name of """", San Ysidro, CA."	Discipline	3/26/2012
5354	First Run	5354	No action	No Action	Pink	201302630	CBP Border Patrol-Other Employee	JIM HOGG, TX	Lost credentials DDD	Lost equipment / badges	12/18/2012
7547	Second Run	218	Counseling	Counseling	Blue	200911831	CBP Border Patrol-Agent	TULARE, CA	Lost credentials	Lost equipment / badges	9/3/2009
2154	First Run	2154	No action	No Action	Blue	200908859	CBP Border Patrol-Agent	CAMERON, TX	K-9 Bite Incident	Discipline	6/10/2009
2827	First Run	2827	Counseling	Counseling	Blue	200910773	CBP Border Patrol- Supervisor	SANTA CRUZ, AZ	Vehicle Accident	Vehicle	8/6/2009
8152	Second Run	823	Suspension	3 Day Suspension	Blue	201000610	CBP Border Patrol- Supervisor	EL PASO, TX	Asked Subordinates to Query Govt Databases for Unofficial Reasons	Misconduct	
9221	Second Run	854	No action	No Action	Purple	201206428	CBP Officer	EL PASO, TX	Allowing vehicles into U.S. utilizing the official vehicle override function on vehicles not on official business	Misconduct	3/22/2012
8788	Second Run	421	Admonishment / reprimand	Written Reprimand	Purple	201205137	CBP Officer	SAN DIEGO, CA	CBPO reported use of cellular phone while on duty, Otay Mesa, CA	Discipline	2/15/2012
6828	Second Run	16	Invalid case / access denied 	Case # is invalid/access is denied	Yellow	200604319	CBP Officer	IMPERIAL, CA	Allegedly involved in smuggling marijuana into the U.S.	Smuggling	4/18/2006
9978	Second Run	1611	No action	No Action	Purple	201208690	CBP Border Patrol- Supervisor	PIMA, AZ	Vehicle Damage: Tree fell on rental vehicle	Vehicle	7/4/2011
7417	Second Run	88	Admonishment / reprimand	Reprimand	Blue	200911506	CBP Border Patrol-Agent	HIDALGO, TX	vehicle accident (M-85872)	Vehicle	7/14/2009
7832	Second Run	503	Counseling	Counseling	Blue	200912658	CBP Border Patrol-Agent	IMPERIAL, CA	BPAI LOST HER COLLAPSIBLE STEEL BATON.	Lost equipment / badges	9/7/2009
8997	Second Run	630	No action	No Action	Purple	201205801	CBP Border Patrol-Agent	PIMA, AZ	An Order of Protection was filed against BPA ACUNA which prohibits him from possessing a firearm (Tucson, AZ).	Off-duty	2/2/2012
7000	Second Run	188	No disposition	Disposition not provided	Yellow	200604894	CBP Border Patrol- Supervisor	HIDALGO, TX	Allegedly purposely omitted names of employees for DHS Secretary Awards.	Discipline	5/12/2006
7617	Second Run	288	No action	No Action	Blue	200912039	CBP Border Patrol-Agent	COCHISE, AZ	Illegal aliens escaped from Border Patrol Agents' custody.	Discipline	9/10/2009
8646	Second Run	279	No action	No Action	Purple	201204722	CBP Border Patrol-Agent	SANTA CRUZ, AZ	Alien alleged he was physically abused by BPA during apprehension/arrest,Nogales, AZ.	Force	2/6/2012
2850	First Run	2850	No action	No Action	Blue	200910820	CBP Border Patrol-Agent	OTERO, NM	Allegation of corrupt CBP Border Patrol Agents at the Alamagordo Station in Alamogordo, NM	Misconduct	7/31/2009
1267	First Run	1267	No action	No action	Orange	200802061	CBP Border Patrol-Agent	PIMA, AZ	BPA allegedly got personal info from official gov't database/making harassing phone calls to BPA's wife	Off-duty	11/30/2007
8830	Second Run	463	Suspension	3-Day Suspension	Purple	201205278	CBP Supervisory Officer	LOS ANGELES, CA	SCBPO allegedly arrested by CHP for DUI on February 18, 2012, Los Angeles, CA	Off-duty	2/21/2012
5048	First Run	5048	Counseling	Formal Counseling	Pink	201301854	CBP Officer	SANTA CRUZ, AZ	Disciplinary Unprofessional Conduct	Misconduct	11/21/2012
4383	First Run	4383	Admonishment / reprimand	Oral Reprimand	Purple	201203278	CBP Border Patrol-Agent	SANTA CRUZ, AZ	GOV Accident - ATV flipped over going around a curve	Vehicle	12/6/2011
2354	First Run	2354	Invalid case / access denied 	Case # is invalid/access is denied	Blue	200909472	CBP Border Patrol-Agent	HIDALGO, TX	BPA(T) arrested by Mercedes, TX, PD in January 2008 for Assault	Off-duty	7/2/2009
8567	Second Run	200	No action	No Action	Purple	201204471	CBP Border Patrol-Agent	COCHISE, AZ	BPA(t) was allegedly verbally abusive, and attempted to provoke a fight with, a co-worker. Douglas, AZ.	Misconduct	1/28/2012
540	First Run	540	Suspension	14 Day Suspension	Yellow	200601690	CBP Border Patrol-Agent	SAN DIEGO, CA	Alleged physical abuse of illegal alien	Force	12/27/2005
9710	Second Run	1343	Invalid case / access denied 	Case # is invalid/access is denied	Purple	201207959	CBP Border Patrol-Agent	KENEDY, TX	BP agents allegedly assisting smuggle drugs thru Sarita, TX checkpoint	Smuggling	4/27/2012
4976	First Run	4976	Pending	Pending decision	Pink	201301707	CBP Border Patrol-Agent	ERIE, NY	BPA allegedly accepted outside employment with another LE agency without resigning from BP. (Chula Vista, CA)	Discipline	11/16/2012
8743	Second Run	376	Counseling	Counseling	Purple	201205009	CBP Border Patrol-Agent	IMPERIAL, CA	BPA alleged disreputable association with female linked to TECS subject record for “Narcotics Look Out”, Calexico, CA	Association	2/13/2012
6652	First Run	6652	Invalid case / access denied 	Case # is invalid/access denied	Pink	201306127	CBP Border Patrol-Agent	WEBB, TX	BPA: Allegedly married to illegal alien, Laredo, TX	Association	4/1/2013
9031	Second Run	664	Admonishment / reprimand	Written Reprimand	Purple	201205899	CBP Border Patrol-Agent	EL PASO, TX	Vehicle Accident: BPA struck GOV M74975	Vehicle	1/17/2012
3305	First Run	3305	Invalid case / access denied 	Case # is invalid/access is denied	Purple	201114118	CBP Border Patrol-Agent	SANTA CRUZ, AZ	GOV Accident - Service vehicle struck a yellow safety pole in a McDonald's Drive-Through	Vehicle	9/14/2011
9095	Second Run	728	Counseling	Counseling	Purple	201206066	CBP Border Patrol-Agent	PIMA, AZ	BPA involved in canine bite incident, Tucson, AZ.	Force	3/9/2012
6740	First Run	6740	Other	with LER	Pink	201306356	CBP Border Patrol-Agent	CAMERON, TX	Allegation received that UDAs in Border Patrol custody are not afforded proper hygiene, medical evaluation or presented before a Magistrate, Port Isabel, TX	Misconduct	3/27/2013
7737	Second Run	408	No action	No Action	Blue	200912403	CBP Officer	WEBB, TX	Alleged misconduct and mistreatment by CBPO/Laredo, TX	Misconduct	9/16/2009
846	First Run	846	Terminated / removed	Termination	Yellow	200602968	CBP Border Patrol-Agent	YUMA, AZ	Intentional discharge of service weapon (no injuries)	Weapon discharge	2/21/2006
2656	First Run	2656	Invalid case / access denied 	Case # is invalid/access is denied	Blue	200910313	CBP Border Patrol-Agent	HUDSPETH, TX	Unknown BPA alleged to be assisting an alien smuggler, Sierra Blanca, TX	Smuggling	7/24/2009
4371	First Run	4371	Invalid case / access denied 	Case # is invalid/access is denied	Purple	201203252	CBP Border Patrol-Agent	HIDALGO, TX	Female BPA, McAllen,TX, allegedly facilitates the entry of undocumented aliens into the U.S. (McAllen, TX).	Smuggling	12/22/2011
11165	Second Run	1076	No action	No Action	Pink	201309482	CBP Officer	PIMA, AZ	CBPO reported U.S. Marshal came to residence, Tucson, AZ.	Off-duty	6/20/2013
319	First Run	319	Admonishment / reprimand	Written Reprimand	Yellow	200600882	CBP Border Patrol-Agent	JIM HOGG, TX	Agent lost hand held radio.	Lost equipment / badges	10/21/2005
